"MedicationID","MedicationName","GenericName","DosageForm","Strength","Indications","SideEffects","Contraindications","SymptomsDrugAllergies","TreatDrugAllergies"
"31","Hydrocortisone Cream","Hydrocortisone","ทา","1%","ลดการอักเสบและอาการคันจากริดสีดวงทวาร","ผิวหนังบางลงเมื่อใช้ระยะยาว  ระคายเคืองหรือแสบผิวหนัง","แพ้ยากลุ่มสเตียรอยด์  ห้ามใช้ในบริเวณที่มีแผลเปิดหรือการติดเชื้อ","ผื่นแดง บวม ผิวหนังลอก  คันหรือแสบรุนแรง","หยุดใช้ยา

ใช้ยาแก้แพ้

ปรึกษาแพทย์ทันทีหากอาการรุนแรง"
"32","Metronidazole","Metronidazole","น้ำ","500 mg","รักษาการติดเชื้อแบคทีเรียและปรสิตในลำไส้","คลื่นไส้  ปวดศีรษะ  รสชาติในปากเปลี่ยนไป","ห้ามใช้ร่วมกับแอลกอฮอล์  หญิงตั้งครรภ์ในไตรมาสแรกควรปรึกษาแพทย์ก่อนใช้ยา","ผื่นคัน  บวมที่ใบหน้า  หายใจลำบาก","หยุดใช้ยา

พบแพทย์ทันที

อาจให้ยาแก้แพ้หรือยาฉีดเพื่อบรรเทาอาการ"
"33","Paracetamol","Paracetamol","เม็ด","500 mg","บรรเทาอาการปวดและลดไข้ในผู้ป่วยที่ได้รับบาดเจ็บจากรถล้ม  ใช้ในกรณีที่ไม่มีอาการอักเสบรุนแรงที่ต้องใช้ยาแก้อักเสบ","อาจเกิดอาการแพ้ เช่น ผื่นลมพิษ  ในกรณีใช้ยาปริมาณสูงอาจทำให้ตับได้รับความเสียหาย","ผู้ที่แพ้พาราเซตามอล  ผู้ที่มีโรคตับรุนแรง","ผื่นแดง คัน  บวมบริเวณใบหน้า หรือริมฝีปาก  หายใจลำบาก หรือเสียงหายใจเปลี่ยนไป  เวียนศีรษะหมดสติ","หยุดใช้ยาทันที

รับประทานยาต้านฮิสตามีน (Antihistamine)

หากมีอาการรุนแรง เช่น หายใจลำบาก ต้องรีบพบแพทย์ด่วน"
"34","Paracetamol","Paracetamol","เม็ด","500 mg","บรรเทาอาการปวด บวม และไข้ เช่น อาการปวดกล้ามเนื้อหรือปวดจากการบาดเจ็บ","คลื่นไส้ วิงเวียนศีรษะ หรืออาการแพ้ (พบได้น้อย)","ผู้ที่เป็นโรคตับหรือแพ้ยานี้","ผื่น ลมพิษ หายใจลำบาก หน้าบวม","หยุดยา ทานยาต้านฮิสตามีน และรีบพบแพทย์"
"35","Ibuprofen","Ibuprofen","เม็ด","400 mg","บรรเทาอาการปวดและลดการอักเสบจากกล้ามเนื้อหรือข้อต่อที่บาดเจ็บ","ปวดท้อง คลื่นไส้ เลือดออกในกระเพาะอาหาร (ในบางราย)","ผู้มีประวัติโรคกระเพาะอาหาร โรคไต หรือแพ้ NSAIDs","หายใจลำบาก ผื่น ลมพิษ บวมที่หน้าและลำคอ","หยุดยา ทานยาต้านฮิสตามีน รีบพบแพทย์ทันที"
"36","Chlorpheniramine","Chlorpheniramine Maleate","เม็ด","4 mg","บรรเทาอาการบวม อักเสบ และแพ้บริเวณลำคอ หากเกิดอาการแพ้หรือระคายเคืองจากก้าง","ง่วงซึม ปากแห้ง มึนศีรษะ","ห้ามใช้ในผู้ที่แพ้ยากลุ่ม antihistamines","ผื่น ลมพิษ หายใจติดขัด หรือบวมที่หน้า/ปาก","หยุดยา รับประทานยาต้านฮิสตามีนอื่น หรือรีบพบแพทย์ทันที"
"37","Amoxicillin","Amoxicillin","เม็ด","500 mg","ป้องกันและรักษาการติดเชื้อแบคทีเรียในแผล","ท้องเสีย คลื่นไส้ ผื่น","แพ้ยาในกลุ่มเพนิซิลลิน (Penicillin)","หายใจติดขัด ผื่นลมพิษ หน้าบวม ปากบวม","หยุดยา รับประทานยาต้านฮิสตามีน พบแพทย์ทันที"
"39","Canesten cream","Clotrimazole","ทา","1%","รักษากลาก เกลื้อน เชื้อราที่ผิวหนัง เชื้อราขาหนีบ เชื้อราที่เท้า","คัน แสบร้อน แดง ลอกบริเวณที่ทา อาการเหล่านี้มักหายได้เอง","ห้ามใช้หากมีประวัติแพ้ตัวยานั้นๆ ห้ามทาบริเวณแผลเปิดหรือรอบดวงตา","ผื่นแดงมาก คันรุนแรง แสบ พอง หรือผิวหนังลอกผิดปกติ","หยุดใช้ยาทันที ล้างยาด้วยน้ำสะอาด พบแพทย์เพื่อรับยาแก้แพ้ หากรุนแรงให้พบแพทย์ด่วน"
"40","Zovirax","Acyclovir","ทา","5%","ใช้รักษาการติดเชื้อไวรัส เช่น เริมที่ริมฝีปาก, เริมที่อวัยวะเพศ, งูสวัด ในระยะเริ่มต้น","คัน ระคายเคือง แสบเล็กน้อย ผิวแห้งลอกบริเวณที่ทา","ห้ามใช้ในผู้ที่แพ้ Acyclovir หรือส่วนประกอบในยา ห้ามใช้ในดวงตา ปาก หรือภายในช่องคลอด","ผื่นแดง คัน บวมบริเวณที่ทา หายใจลำบาก (ในกรณีแพ้รุนแรง)","หยุดใช้ยา ทายาลดการอักเสบ (ตามแพทย์สั่ง), หากแพ้รุนแรงควรรีบพบแพทย์ทันทีเพื่อรับยาต้านอาการแพ้หรือฉีด Adrenaline"
"41","Calamine Lotion","Calamine","ทา","15%","บรรเทาอาการคัน ระคายเคือง","ผิวแห้ง, เย็น","แพ้ส่วนผสม","ผื่นแดง คันลุกลาม","หยุดใช้ ทายาลดอักเสบ พบแพทย์หากไม่ดีขึ้น"
"42","Calamine Lotion","Calamine","ทา","15%","บรรเทาอาการคันและระคายเคืองผิว","ผิวแห้ง","ห้ามใช้ในผู้แพ้ส่วนประกอบ","ผื่นแดง คัน","หยุดใช้ยา ทายาอื่นตามคำแนะนำแพทย์
"
"43","Calamine Lotion","Calamine","ทา","15%","บรรเทาอาการคันและระคายเคืองผิว","ผิวแห้ง","แพ้ส่วนประกอบของโลชั่น","ผื่นแดง คัน","หยุดใช้ยา ทายาอื่นตามคำแนะนำแพทย์"
"44","Paracetamol","Paracetamol","เม็ด","500 mg","บรรเทาอาการปวดจากแผลและไข้","คลื่นไส้ ปวดท้อง","แพ้พาราเซตามอล","ผื่น ลมพิษ","หยุดยา ยาทดแทนตามคำแนะนำแพทย์"
"45","Paracetamol","Paracetamol","เม็ด","500 mg","บรรเทาอาการปวดถ้ามี","คลื่นไส้ ปวดท้อง","แพ้พาราเซตามอล","ผื่น ลมพิษ","หยุดยา ยาทดแทนตามคำแนะนำแพทย์"
"46","Flonase","Fluticasone Propionate","พ่น","50 mcg","ลดอาการอักเสบและคัดจมูกจากภูมิแพ้","แสบจมูก แสบคอ","แพ้ Fluticasone","แสบคอ แดง คัน","หยุดยา พบแพทย์ทันที"
"47","Nurofen","Ibuprofen","เม็ด","200 mg","ลดไข้ ลดปวด ลดการอักเสบ","ปวดท้อง แสบกระเพาะอาหาร","แพ้ไอบูโพรเฟน","ผื่น แดง บวม","หยุดยา พบแพทย์ทันที"
"48","Flonase","Fluticasone Propionate","พ่น","50 mcg","ลดการอักเสบในโพรงจมูกและไซนัส","แสบจมูก แสบคอ","แพ้ Fluticasone","แสบคอ แดง คัน","หยุดยา พบแพทย์ทันที"
"49","Paracetamol","Paracetamol","เม็ด","500 mg","ลดปวดหากมีอาการปวดเหงือก","คลื่นไส้ ปวดท้อง","แพ้พาราเซตามอล","ผื่น ลมพิษ","หยุดใช้ ยาทดแทนตามแพทย์แนะนำ"
"50","Smecta","Diosmectite","ผง","3 g","เคลือบลำไส้ ลดอาการถ่ายเหลว","ท้องผูก ท้องอืด","ห้ามใช้ในผู้ที่ลำไส้อุดตัน","ผื่น คัน ปากบวม","หยุดยา พบแพทย์"
"51","ORS (เกลือแร่)","Oral Rehydration Salt","ผง","ตามสูตร WHO","ป้องกันการขาดน้ำ","ท้องอืด (ถ้าดื่มเร็ว)","ห้ามในภาวะน้ำท่วมปอด/ไตวายเฉียบพลัน","ระคายช่องปาก แน่นหน้าอก","ล้างปาก หยุดใช้ พบแพทย์"
"52","Colchicine","Colchicine","เม็ด","0.5 mg","รักษาและป้องกันเกาต์เฉียบพลัน","ท้องเสีย คลื่นไส้","โรคไตขั้นรุนแรง, หญิงตั้งครรภ์","ผื่น ลมพิษ คลื่นไส้","หยุดยา พบแพทย์ทันที"
"53","Paracetamol","Paracetamol","เม็ด","500 mg","บรรเทาอาการปวด","ปวดท้อง","ผู้ที่แพ้ยา","ผื่น, คัน","หยุดยา พบแพทย์ทันที"
"54","Diclofenac Gel","Diclofenac Sodium","ทา","1-3%","ลดอาการปวดและอักเสบเฉพาะที่","แสบหรือระคายเคืองผิวหนัง","แพ้ยาในกลุ่ม NSAIDs","ผื่น แดง บวม","ล้างออกและหยุดใช้ยา"
